### ISSUE TITLE
Smart Plug WIFI 10A - No heartbeat messages via mqtt

### ISSUE THREAD

**Issue by PrathikGopal** [dtechterminal/qubo-local-control#3]
Hi, the setup is not working for me, can you help troubleshoot. Ive tried the following but no avail.

1. I've setup the DNS to redirect to the local MQTT server via adguard(logs show redirection correctly). Setup HA integration and tried the auto discover but it takes me to manual page asking for UUID.
2. Tried the manual method using below command, but yeilds nothing even after numerous time ive recycled power
 `mosquitto_sub -h 192.168.0.200 -p 1883 -u <redacted> -P  <redacted>  -t '/monitor/+/+/heartbeat' -v`

3. Used a mqtt explorer too but cant seem to capture anything.
4. Setup a seperate mqtt server with anonymous login but cant capture anything there too.

Can you let me know if there is somthing else im missing

**Comment by ankurpandeyvns** [comment]
you need to use tcpdump to verify which port is it connecting with.

**Comment by gauravpandey44** [comment]
I am also facing the same issue, I checked with tcpdump on my openwrt router logs and it says :

its trying to connect to same : `mqtt.platform.quboworld.com` and then also `srvc.platform.quboworld.com`.
1. I tried to point the dns of  `mqtt.platform.quboworld.com`  to point to my local MQTT (with tls and anonymous access) 
2. I also tried to point both `mqtt.platform.quboworld.com`  and  `srvc.platform.quboworld.com` to my local MQTT but nothing is observed in my MQTT.

**Comment by ankurpandeyvns** [comment]
check which port is it using. It might be using a non standard port

**Comment by gauravpandey44** [comment]
These are the tcpdump logs when all local dns pointer removed, `192.168.0.26`: this is the IP of my qubo plug 

```bash
01:44:24.445649 br-lan Out IP pi.hole.67 > 192.168.0.26.68: BOOTP/DHCP, Reply, length 300
01:44:24.445663 eth1  Out IP pi.hole.67 > 192.168.0.26.68: BOOTP/DHCP, Reply, length 300
01:44:24.453332 br-lan Out IP pi.hole.67 > 192.168.0.26.68: BOOTP/DHCP, Reply, length 300
01:44:24.453341 eth1  Out IP pi.hole.67 > 192.168.0.26.68: BOOTP/DHCP, Reply, length 300
01:44:24.459179 eth1  B   ARP, Request who-has 192.168.0.26 tell pi.hole, length 46
01:44:24.459179 br-lan B   ARP, Request who-has 192.168.0.26 tell pi.hole, length 46
01:44:24.958125 eth1  B   ARP, Request who-has 192.168.0.26 tell pi.hole, length 46
01:44:24.958125 br-lan B   ARP, Request who-has 192.168.0.26 tell pi.hole, length 46
01:44:25.377357 eth1  B   ARP, Request who-has 192.168.0.26 tell pi.hole, length 46
01:44:25.377357 br-lan B   ARP, Request who-has 192.168.0.26 tell pi.hole, length 46
01:44:25.469347 eth1  B   ARP, Request who-has 192.168.0.26 tell 192.168.0.26, length 46
01:44:25.469347 br-lan B   ARP, Request who-has 192.168.0.26 tell 192.168.0.26, length 46
01:44:26.391003 eth1  B   ARP, Request who-has 192.168.0.26 tell 192.168.0.26, length 46
01:44:26.391003 br-lan B   ARP, Request who-has 192.168.0.26 tell 192.168.0.26, length 46
01:44:26.698131 eth1  B   ARP, Request who-has pi.hole tell 192.168.0.26, length 46
01:44:26.698131 br-lan B   ARP, Request who-has pi.hole tell 192.168.0.26, length 46
01:44:26.698180 br-lan Out ARP, Reply pi.hole is-at 1c:61:b4:be:ef:55 (oui Unknown), length 28
01:44:26.698188 eth1  Out ARP, Reply pi.hole is-at 1c:61:b4:be:ef:55 (oui Unknown), length 28
01:44:26.708473 eth1  In  IP 192.168.0.26.2875 > pi.hole.53: 52474+ A? 0.in.pool.ntp.org. (35)
01:44:26.708473 br-lan In  IP 192.168.0.26.2875 > pi.hole.53: 52474+ A? 0.in.pool.ntp.org. (35)
01:44:26.711596 br-lan Out IP pi.hole.53 > 192.168.0.26.2875: 52474 4/0/0 A 192.46.210.39, A 162.159.200.123, A 95.216.144.226, A 95.216.192.15 (99)
01:44:26.711611 eth1  Out IP pi.hole.53 > 192.168.0.26.2875: 52474 4/0/0 A 192.46.210.39, A 162.159.200.123, A 95.216.144.226, A 95.216.192.15 (99)
01:44:26.714210 eth1  In  IP 192.168.0.26.64120 > ntp7.mum-in.hosts.301-moved.de.123: NTPv4, Client, length 48
01:44:26.714210 br-lan In  IP 192.168.0.26.64120 > ntp7.mum-in.hosts.301-moved.de.123: NTPv4, Client, length 48
01:44:26.742597 br-lan Out IP ntp7.mum-in.hosts.301-moved.de.123 > 192.168.0.26.64120: NTPv4, Server, length 48
01:44:26.742610 eth1  Out IP ntp7.mum-in.hosts.301-moved.de.123 > 192.168.0.26.64120: NTPv4, Server, length 48
01:44:27.005351 eth1  In  IP 192.168.0.26.50003 > pi.hole.53: 37574+ A? mqtt.platform.quboworld.com. (45)
01:44:27.005351 br-lan In  IP 192.168.0.26.50003 > pi.hole.53: 37574+ A? mqtt.platform.quboworld.com. (45)
01:44:27.015490 br-lan Out IP pi.hole.53 > 192.168.0.26.50003: 37574 1/0/0 A 65.1.150.122 (61)
01:44:27.015508 eth1  Out IP pi.hole.53 > 192.168.0.26.50003: 37574 1/0/0 A 65.1.150.122 (61)
01:44:27.018949 eth1  In  IP 192.168.0.26.59215 > ec2-65-1-150-122.ap-south-1.compute.amazonaws.com.8883: Flags [S], seq 2135884015, win 5744, options [mss 1440], length 0
01:44:27.018949 br-lan In  IP 192.168.0.26.59215 > ec2-65-1-150-122.ap-south-1.compute.amazonaws.com.8883: Flags [S], seq 2135884015, win 5744, options [mss 1440], length 0
01:44:27.050903 br-lan Out IP ec2-65-1-150-122.ap-south-1.compute.amazonaws.com.8883 > 192.168.0.26.59215: Flags [S.], seq 3424768407, ack 2135884016, win 26883, options [mss 1250], length 0
01:44:27.050915 eth1  Out IP ec2-65-1-150-122.ap-south-1.compute.amazonaws.com.8883 > 192.168.0.26.59215: Flags [S.], seq 3424768407, ack 2135884016, win 26883, options [mss 1250], length 0
01:44:27.107725 eth1  In  IP 192.168.0.26.59215 > ec2-65-1-150-122.ap-south-1.compute.amazonaws.com.8883: Flags [.], ack 1, win 5744, length 0
01:44:27.107725 br-lan In  IP 192.168.0.26.59215 > ec2-65-1-150-122.ap-south-1.compute.amazonaws.com.8883: Flags [.], ack 1, win 5744, length 0
01:44:27.107725 eth1  In  IP 192.168.0.26.59215 > ec2-65-1-150-122.ap-south-1.compute.amazonaws.com.8883: Flags [P.], seq 1:111, ack 1, win 5744, length 110
01:44:27.107725 br-lan In  IP 192.168.0.26.59215 > ec2-65-1-150-122.ap-south-1.compute.amazonaws.com.8883: Flags [P.], seq 1:111, ack 1, win 5744, length 110
01:44:27.140430 br-lan Out IP ec2-65-1-150-122.ap-south-1.compute.amazonaws.com.8883 > 192.168.0.26.59215: Flags [.], ack 111, win 26883, length 0
01:44:27.140439 eth1  Out IP ec2-65-1-150-122.ap-south-1.compute.amazonaws.com.8883 > 192.168.0.26.59215: Flags [.], ack 111, win 26883, length 0
01:44:27.140516 br-lan Out IP ec2-65-1-150-122.ap-south-1.compute.amazonaws.com.8883 > 192.168.0.26.59215: Flags [P.], seq 1:91, ack 111, win 26883, length 90
01:44:27.140523 eth1  Out IP ec2-65-1-150-122.ap-south-1.compute.amazonaws.com.8883 > 192.168.0.26.59215: Flags [P.], seq 1:91, ack 111, win 26883, length 90
01:44:27.140563 br-lan Out IP ec2-65-1-150-122.ap-south-1.compute.amazonaws.com.8883 > 192.168.0.26.59215: Flags [.], seq 91:1341, ack 111, win 26883, length 1250
01:44:27.140572 eth1  Out IP ec2-65-1-150-122.ap-south-1.compute.amazonaws.com.8883 > 192.168.0.26.59215: Flags [.], seq 91:1341, ack 111, win 26883, length 1250
01:44:27.140631 br-lan Out IP ec2-65-1-150-122.ap-south-1.compute.amazonaws.com.8883 > 192.168.0.26.59215: Flags [.], seq 1341:2591, ack 111, win 26883, length 1250
01:44:27.140639 eth1  Out IP ec2-65-1-150-122.ap-south-1.compute.amazonaws.com.8883 > 192.168.0.26.59215: Flags [.], seq 1341:2591, ack 111, win 26883, length 1250
01:44:27.140643 br-lan Out IP ec2-65-1-150-122.ap-south-1.compute.amazonaws.com.8883 > 192.168.0.26.59215: Flags [.], seq 2591:3841, ack 111, win 26883, length 1250
01:44:27.140648 eth1  Out IP ec2-65-1-150-122.ap-south-1.compute.amazonaws.com.8883 > 192.168.0.26.59215: Flags [.], seq 2591:3841, ack 111, win 26883, length 1250
01:44:27.140669 br-lan Out IP ec2-65-1-150-122.ap-south-1.compute.amazonaws.com.8883 > 192.168.0.26.59215: Flags [P.], seq 3841:4041, ack 111, win 26883, length 200
01:44:27.140675 eth1  Out IP ec2-65-1-150-122.ap-south-1.compute.amazonaws.com.8883 > 192.168.0.26.59215: Flags [P.], seq 3841:4041, ack 111, win 26883, length 200
01:44:27.209954 eth1  In  IP 192.168.0.26.59215 > ec2-65-1-150-122.ap-south-1.compute.amazonaws.com.8883: Flags [.], ack 1341, win 4404, length 0
01:44:27.209954 br-lan In  IP 192.168.0.26.59215 > ec2-65-1-150-122.ap-south-1.compute.amazonaws.com.8883: Flags [.], ack 1341, win 4404, length 0
01:44:27.210404 eth1  In  IP 192.168.0.26.59215 > ec2-65-1-150-122.ap-south-1.compute.amazonaws.com.8883: Flags [.], ack 3841, win 1904, length 0
01:44:27.210404 br-lan In  IP 192.168.0.26.59215 > ec2-65-1-150-122.ap-south-1.compute.amazonaws.com.8883: Flags [.], ack 3841, win 1904, length 0
01:44:27.210404 eth1  In  IP 192.168.0.26.59215 > ec2-65-1-150-122.ap-south-1.compute.amazonaws.com.8883: Flags [.], ack 4041, win 5735, length 0
01:44:27.210404 br-lan In  IP 192.168.0.26.59215 > ec2-65-1-150-122.ap-south-1.compute.amazonaws.com.8883: Flags [.], ack 4041, win 5735, length 0
01:44:27.210404 eth1  In  IP 192.168.0.26.59215 > ec2-65-1-150-122.ap-south-1.compute.amazonaws.com.8883: Flags [P.], seq 111:378, ack 4041, win 5735, length 267
01:44:27.210404 br-lan In  IP 192.168.0.26.59215 > ec2-65-1-150-122.ap-south-1.compute.amazonaws.com.8883: Flags [P.], seq 111:378, ack 4041, win 5735, length 267
01:44:27.239993 br-lan Out IP ec2-65-1-150-122.ap-south-1.compute.amazonaws.com.8883 > 192.168.0.26.59215: Flags [.], ack 378, win 27872, length 0
01:44:27.240004 eth1  Out IP ec2-65-1-150-122.ap-south-1.compute.amazonaws.com.8883 > 192.168.0.26.59215: Flags [.], ack 378, win 27872, length 0
01:44:27.242447 eth1  In  IP 192.168.0.26.59215 > ec2-65-1-150-122.ap-south-1.compute.amazonaws.com.8883: Flags [P.], seq 378:429, ack 4041, win 5735, length 51
01:44:27.242447 br-lan In  IP 192.168.0.26.59215 > ec2-65-1-150-122.ap-south-1.compute.amazonaws.com.8883: Flags [P.], seq 378:429, ack 4041, win 5735, length 51
01:44:27.275131 br-lan Out IP ec2-65-1-150-122.ap-south-1.compute.amazonaws.com.8883 > 192.168.0.26.59215: Flags [.], ack 429, win 27872, length 0
01:44:27.275140 eth1  Out IP ec2-65-1-150-122.ap-south-1.compute.amazonaws.com.8883 > 192.168.0.26.59215: Flags [.], ack 429, win 27872, length 0
01:44:27.275174 br-lan Out IP ec2-65-1-150-122.ap-south-1.compute.amazonaws.com.8883 > 192.168.0.26.59215: Flags [P.], seq 4041:4047, ack 429, win 27872, length 6
01:44:27.275184 eth1  Out IP ec2-65-1-150-122.ap-south-1.compute.amazonaws.com.8883 > 192.168.0.26.59215: Flags [P.], seq 4041:4047, ack 429, win 27872, length 6
01:44:27.275217 br-lan Out IP ec2-65-1-150-122.ap-south-1.compute.amazonaws.com.8883 > 192.168.0.26.59215: Flags [P.], seq 4047:4092, ack 429, win 27872, length 45
01:44:27.275223 eth1  Out IP ec2-65-1-150-122.ap-south-1.compute.amazonaws.com.8883 > 192.168.0.26.59215: Flags [P.], seq 4047:4092, ack 429, win 27872, length 45
01:44:27.323742 eth1  In  IP 192.168.0.26.59215 > ec2-65-1-150-122.ap-south-1.compute.amazonaws.com.8883: Flags [.], ack 4092, win 5684, length 0
01:44:27.323742 br-lan In  IP 192.168.0.26.59215 > ec2-65-1-150-122.ap-south-1.compute.amazonaws.com.8883: Flags [.], ack 4092, win 5684, length 0
01:44:27.323742 eth1  In  IP 192.168.0.26.59215 > ec2-65-1-150-122.ap-south-1.compute.amazonaws.com.8883: Flags [.], ack 4092, win 5684, length 0
01:44:27.323742 br-lan In  IP 192.168.0.26.59215 > ec2-65-1-150-122.ap-south-1.compute.amazonaws.com.8883: Flags [.], ack 4092, win 5684, length 0
01:44:27.349057 eth1  In  IP 192.168.0.26.59215 > ec2-65-1-150-122.ap-south-1.compute.amazonaws.com.8883: Flags [P.], seq 429:1429, ack 4092, win 5684, length 1000
01:44:27.349057 br-lan In  IP 192.168.0.26.59215 > ec2-65-1-150-122.ap-south-1.compute.amazonaws.com.8883: Flags [P.], seq 429:1429, ack 4092, win 5684, length 1000
01:44:27.385960 br-lan Out IP ec2-65-1-150-122.ap-south-1.compute.amazonaws.com.8883 > 192.168.0.26.59215: Flags [P.], seq 4092:4125, ack 1429, win 45000, length 33
01:44:27.385968 eth1  Out IP ec2-65-1-150-122.ap-south-1.compute.amazonaws.com.8883 > 192.168.0.26.59215: Flags [P.], seq 4092:4125, ack 1429, win 45000, length 33

```

**Comment by Lalit-Patil-07** [comment]
@gauravpandey44 The tcpdump shows that while the device is using Pi-hole for DNS, mqtt.platform.quboworld.com is not being overridden and is still resolving to the QUBO cloud IP, so the device connects to the cloud MQTT broker on port 8883 and no heartbeats appear locally. To fix this, add mqtt.platform.quboworld.com as a Local DNS record in Pi-hole pointing to your local MQTT broker’s IP, make sure your router is configured to use Pi-hole as its DNS server so all clients resolve locally, restart Pi-hole DNS, and then fully power-cycle the device so it picks up the new DNS entry.

**Comment by Lalit-Patil-07** [comment]
@PrathikGopal please also check the MQTT port configuration — QUBO devices require MQTT over SSL/TLS on port 8883. If the broker is only listening on a non-SSL port (like 1883), the device will not connect and no heartbeats will be published. Make sure your MQTT broker is configured with SSL enabled on port 8883, then reboot the device for the changes to take effect.

**Comment by gauravpandey44** [comment]
@Lalit-Patil-07 

> [@gauravpandey44](https://github.com/gauravpandey44) The tcpdump shows that while the device is using Pi-hole for DNS, mqtt.platform.quboworld.com is not being overridden and is still resolving to the QUBO cloud IP, so the device connects to the cloud MQTT broker on port 8883 and no heartbeats appear locally. To fix this, add mqtt.platform.quboworld.com as a Local DNS record in Pi-hole pointing to your local MQTT broker’s IP, make sure your router is configured to use Pi-hole as its DNS server so all clients resolve locally, restart Pi-hole DNS, and then fully power-cycle the device so it picks up the new DNS entry.



---

Based on the tcpdump logs I shared earlier, when all local DNS overrides are removed from Pi-hole, the Qubo plug (IP `192.168.0.26`) directly connects to the Qubo cloud servers. This confirms that the device normally relies on external DNS resolution to reach its backend.

When I configure a DNS host override in Pi-hole to point the Qubo broker hostname to my **local Mosquitto broker** (running on `192.168.0.129`), and even after power-cycling the router and Qubo plugs, I still do **not** see any connection attempts or messages reaching my broker.

For reference, my Mosquitto broker is running locally and listening on both non-TLS and TLS ports (`1883` and `8883`):

```bash
tcp        0      0 0.0.0.0:1883            0.0.0.0:*   LISTEN   193/mosquitto
tcp        0      0 0.0.0.0:8883            0.0.0.0:*   LISTEN   193/mosquitto
tcp6       0      0 :::1883                 :::*        LISTEN   193/mosquitto
tcp6       0      0 :::8883                 :::*        LISTEN   193/mosquitto
```

Current Mosquitto configuration:

```conf
persistence true
persistence_location /var/lib/mosquitto/

log_dest file /var/log/mosquitto/mosquitto.log
include_dir /etc/mosquitto/conf.d

# Global authentication
allow_anonymous true
password_file /var/lib/mosquitto/pwfile

################################
# NON-TLS MQTT
################################
listener 1883
protocol mqtt

################################
# TLS MQTT
################################
listener 8883
protocol mqtt
certfile /etc/mosquitto/certs/server.crt
keyfile /etc/mosquitto/certs/server.key
```

I have a few doubts and would appreciate guidance:

1. **Mosquitto TLS configuration**
   It’s possible I’ve misconfigured MQTT over SSL/TLS. If so, could someone point me to a reliable reference or documentation for correctly setting up Mosquitto with TLS (especially for IoT devices)?

2. **Qubo device authentication**
   How do Qubo devices authenticate with their MQTT broker?

   * Do they use a hard-coded username/password?
   * Client certificates?
   * Token-based authentication?

   I’ve set `allow_anonymous true` to rule out auth issues, but the devices still never attempt to connect to my local broker.

At this point, it feels like the devices may be enforcing **certificate pinning, SNI validation, or broker-side authentication** that prevents redirection to a local MQTT server, but I’m not fully sure.

Any suggestions, insights, or debugging pointers would be really helpful.

**Comment by gauravpandey44** [comment]
> [@Lalit-Patil-07](https://github.com/Lalit-Patil-07)
> 
> > [@gauravpandey44](https://github.com/gauravpandey44) The tcpdump shows that while the device is using Pi-hole for DNS, mqtt.platform.quboworld.com is not being overridden and is still resolving to the QUBO cloud IP, so the device connects to the cloud MQTT broker on port 8883 and no heartbeats appear locally. To fix this, add mqtt.platform.quboworld.com as a Local DNS record in Pi-hole pointing to your local MQTT broker’s IP, make sure your router is configured to use Pi-hole as its DNS server so all clients resolve locally, restart Pi-hole DNS, and then fully power-cycle the device so it picks up the new DNS entry.
> 
> Based on the tcpdump logs I shared earlier, when all local DNS overrides are removed from Pi-hole, the Qubo plug (IP `192.168.0.26`) directly connects to the Qubo cloud servers. This confirms that the device normally relies on external DNS resolution to reach its backend.
> 
> When I configure a DNS host override in Pi-hole to point the Qubo broker hostname to my **local Mosquitto broker** (running on `192.168.0.129`), and even after power-cycling the router and Qubo plugs, I still do **not** see any connection attempts or messages reaching my broker.
> 
> For reference, my Mosquitto broker is running locally and listening on both non-TLS and TLS ports (`1883` and `8883`):
> 
> tcp        0      0 0.0.0.0:1883            0.0.0.0:*   LISTEN   193/mosquitto
> tcp        0      0 0.0.0.0:8883            0.0.0.0:*   LISTEN   193/mosquitto
> tcp6       0      0 :::1883                 :::*        LISTEN   193/mosquitto
> tcp6       0      0 :::8883                 :::*        LISTEN   193/mosquitto
> Current Mosquitto configuration:
> 
> ```
> persistence true
> persistence_location /var/lib/mosquitto/
> 
> log_dest file /var/log/mosquitto/mosquitto.log
> include_dir /etc/mosquitto/conf.d
> 
> # Global authentication
> allow_anonymous true
> password_file /var/lib/mosquitto/pwfile
> 
> ################################
> # NON-TLS MQTT
> ################################
> listener 1883
> protocol mqtt
> 
> ################################
> # TLS MQTT
> ################################
> listener 8883
> protocol mqtt
> certfile /etc/mosquitto/certs/server.crt
> keyfile /etc/mosquitto/certs/server.key
> ```
> 
> I have a few doubts and would appreciate guidance:
> 
> 1. **Mosquitto TLS configuration**
>    It’s possible I’ve misconfigured MQTT over SSL/TLS. If so, could someone point me to a reliable reference or documentation for correctly setting up Mosquitto with TLS (especially for IoT devices)?
> 2. **Qubo device authentication**
>    How do Qubo devices authenticate with their MQTT broker?
>    
>    * Do they use a hard-coded username/password?
>    * Client certificates?
>    * Token-based authentication?
>    
>    I’ve set `allow_anonymous true` to rule out auth issues, but the devices still never attempt to connect to my local broker.
> 
> At this point, it feels like the devices may be enforcing **certificate pinning, SNI validation, or broker-side authentication** that prevents redirection to a local MQTT server, but I’m not fully sure.
> 
> Any suggestions, insights, or debugging pointers would be really helpful.

---
> EDIT: I think I have solved it, the issue was with the TLS configurations , will update more on this once I have configured and tested everything.

**Comment by PrathikGopal** [comment]
Thank you for sharing your ideas @Lalit-Patil-07 @gauravpandey44 , I was able to solve it. It was TLS indeed.
